{
  "schema": "constraints/1",
  "study": "gtsio520-h-static",
  "title": "GTSIO-520-H (R10 mechanism study): closure checks and global constraints",
  "note": "Every published figure was read from the page image of the user's own copy of X-30045A (not only the OCR text) on 19 Oct 2026; the page and item are in each locator. A figure that could not be read from a source is a check marked `unknown` with the reason. The IO-520 manual is a related engine and is not used as evidence.",
  "python_path": [
    ".",
    "scripts"
  ],
  "sources": {
    "manual": {
      "title": "Continental GTSIO-520 Series Overhaul Manual X-30045A (March 1981; GTSIO-520-H pages June 1980)",
      "path": "Notes/gtsio520_series.pdf in the course folder (outside Git)",
      "sha256": "c8e7828e978772a55a9271d7bf678cc464ac772987ce7c44cfa3af89c9c21a07",
      "pages": "PDF page = page of the file; the printed page id (for example C-3-2) is given beside it"
    }
  },
  "bindings": {
    "spec_bore": {
      "kind": "json",
      "path": "cad-studies/gtsio520-h-static/part-spec.json",
      "select": "parameters/nominal_bore/value",
      "unit": "mm",
      "locator": "part-spec.json parameters.nominal_bore"
    },
    "spec_stroke": {
      "kind": "json",
      "path": "cad-studies/gtsio520-h-static/part-spec.json",
      "select": "parameters/stroke/value",
      "unit": "mm",
      "locator": "part-spec.json parameters.stroke"
    },
    "spec_rod_length": {
      "kind": "json",
      "path": "cad-studies/gtsio520-h-static/part-spec.json",
      "select": "parameters/rod_length/value",
      "unit": "mm",
      "locator": "part-spec.json parameters.rod_length"
    },
    "spec_pin_width": {
      "kind": "json",
      "path": "cad-studies/gtsio520-h-static/part-spec.json",
      "select": "parameters/pin_width/value",
      "locator": "part-spec.json parameters.pin_width (mm)"
    },
    "spec_crankpins": {
      "kind": "json",
      "path": "cad-studies/gtsio520-h-static/part-spec.json",
      "select": "parts[id=Crankshaft]/features[label^=Crankpin ]/origin",
      "locator": "part-spec.json Crankshaft features 'Crankpin 1' to 'Crankpin 6': origin [x, y, base z] in mm"
    },
    "spec_sump_origins": {
      "kind": "json",
      "path": "cad-studies/gtsio520-h-static/part-spec.json",
      "select": "parts[group==sump]/features/origin",
      "locator": "part-spec.json features of the parts in group 'sump': origin [x, y, z] in mm"
    },
    "layout_firing_order": {
      "kind": "python",
      "module": "cad_pipeline.gtsio_layout",
      "attr": "FIRING_ORDER",
      "locator": "cad_pipeline/gtsio_layout.py FIRING_ORDER (used by the Python motion and the contract's reference poses)"
    },
    "layout_firing_phase": {
      "kind": "python",
      "module": "cad_pipeline.gtsio_layout",
      "attr": "FIRING_PHASE",
      "locator": "cad_pipeline/gtsio_layout.py FIRING_PHASE: crank angle of each cylinder's firing event, degrees"
    },
    "motion_pin_cyl1_0": {
      "kind": "python",
      "module": "cad_pipeline.gtsio_review_motion",
      "attr": "LAYOUT.pose",
      "args": [
        1,
        0
      ],
      "path": "pin",
      "locator": "gtsio_review_motion.LAYOUT.pose(1, 0)['pin']"
    },
    "motion_pin_cyl1_10": {
      "kind": "python",
      "module": "cad_pipeline.gtsio_review_motion",
      "attr": "LAYOUT.pose",
      "args": [
        1,
        10
      ],
      "path": "pin",
      "locator": "gtsio_review_motion.LAYOUT.pose(1, 10)['pin']: cylinder 1's crank pin after 10 degrees of crank rotation"
    },
    "motion_pins_0": {
      "kind": "python",
      "module": "cad_pipeline.gtsio_review_motion",
      "attr": "LAYOUT.pose",
      "foreach": [
        1,
        2,
        3,
        4,
        5,
        6
      ],
      "args": [
        "$",
        0
      ],
      "path": "pin",
      "locator": "gtsio_review_motion.LAYOUT.pose(n, 0)['pin'] for n = 1..6"
    },
    "motion_wrists_0": {
      "kind": "python",
      "module": "cad_pipeline.gtsio_review_motion",
      "attr": "LAYOUT.pose",
      "foreach": [
        1,
        2,
        3,
        4,
        5,
        6
      ],
      "args": [
        "$",
        0
      ],
      "path": "wrist",
      "locator": "gtsio_review_motion.LAYOUT.pose(n, 0)['wrist'] for n = 1..6 (the piston-pin position: on the cylinder axis)"
    },
    "motion_stations": {
      "kind": "python",
      "module": "cad_pipeline.gtsio_review_motion",
      "attr": "LAYOUT.station",
      "foreach": [
        1,
        2,
        3,
        4,
        5,
        6
      ],
      "args": [
        "$"
      ],
      "locator": "gtsio_review_motion.LAYOUT.station(n) for n = 1..6: position along the crank axis, mm"
    },
    "js_firing_order": {
      "kind": "regex",
      "path": "src/viewer/core/animated-study-motion.mjs",
      "pattern": "const FIRING_ORDER = \\[([0-9, ]+)\\];",
      "parse": "int-list",
      "locator": "src/viewer/core/animated-study-motion.mjs:6 FIRING_ORDER"
    },
    "js_phase_step": {
      "kind": "regex",
      "path": "src/viewer/core/animated-study-motion.mjs",
      "pattern": "FIRING_ORDER\\.map\\(\\(n, k\\) => \\[n, k \\* ([0-9.]+)\\]\\)",
      "parse": "float",
      "locator": "src/viewer/core/animated-study-motion.mjs:7 FIRING_PHASE = k * step"
    },
    "js_throw_in": {
      "kind": "regex",
      "path": "src/viewer/core/animated-study-motion.mjs",
      "pattern": "const THROW = ([0-9.]+) \\* INCH;",
      "parse": "float",
      "unit": "in",
      "locator": "src/viewer/core/animated-study-motion.mjs:4 THROW (crank throw radius)"
    },
    "js_rod_length_in": {
      "kind": "regex",
      "path": "src/viewer/core/animated-study-motion.mjs",
      "pattern": "const ROD_LENGTH = ([0-9.]+) \\* INCH;",
      "parse": "float",
      "unit": "in",
      "locator": "src/viewer/core/animated-study-motion.mjs:5 ROD_LENGTH"
    },
    "rate_cam": {
      "kind": "python",
      "module": "accessory_gears",
      "attr": "solve_gtsio_static_drive",
      "call": true,
      "path": "CamshaftGear/rate",
      "locator": "scripts/accessory_gears.py solve_gtsio_static_drive(): signed rate of CamshaftGear (crank 30 teeth, cam 60 teeth)"
    },
    "rate_prop": {
      "kind": "python",
      "module": "accessory_gears",
      "attr": "solve_gtsio_static_drive",
      "call": true,
      "path": "PropellerShaft/rate",
      "locator": "scripts/accessory_gears.py solve_gtsio_static_drive(): signed rate of PropellerShaft (pinion 30 teeth, propeller gear 45 teeth)"
    },
    "rate_left_magneto": {
      "kind": "python",
      "module": "accessory_gears",
      "attr": "solve_gtsio_accessory_drive",
      "call": true,
      "path": "LeftMagnetoGear/rate",
      "locator": "scripts/accessory_gears.py solve_gtsio_accessory_drive(): signed rate of LeftMagnetoGear (crank 30, idler 42, magneto gear 20)"
    },
    "rate_right_magneto": {
      "kind": "python",
      "module": "accessory_gears",
      "attr": "solve_gtsio_accessory_drive",
      "call": true,
      "path": "RightMagnetoGear/rate",
      "locator": "scripts/accessory_gears.py solve_gtsio_accessory_drive(): signed rate of RightMagnetoGear"
    },
    "rate_governor": {
      "kind": "python",
      "module": "accessory_gears",
      "attr": "gtsio_governor_development",
      "call": true,
      "path": "driven/rate",
      "locator": "scripts/accessory_gears.py gtsio_governor_development(): driven bevel gear (55/34 teeth on the cam), signed rate to the crank"
    },
    "rate_tach": {
      "kind": "python",
      "module": "accessory_gears",
      "attr": "gtsio_tach_development",
      "call": true,
      "path": "driven/rate",
      "locator": "scripts/accessory_gears.py gtsio_tach_development(): driven bevel gear (24/24 on the oil shaft), signed rate to the crank"
    },
    "rate_alternator": {
      "kind": "python",
      "module": "accessory_gears",
      "attr": "gtsio_alternator_face_development",
      "call": true,
      "path": "pinion_rate",
      "locator": "scripts/accessory_gears.py gtsio_alternator_face_development(): pinion rate with the face gear at 1 (60/20 teeth)"
    },
    "reduction_z": {
      "kind": "python",
      "module": "accessory_gears",
      "attr": "GTSIO_STATIC_REDUCTION",
      "path": "z_mm",
      "locator": "scripts/accessory_gears.py GTSIO_STATIC_REDUCTION z_mm: axial station of the propeller reduction gears, mm"
    },
    "timing_gear_z": {
      "kind": "python",
      "module": "accessory_gears",
      "attr": "GTSIO_STATIC_DRIVE_GEARS",
      "path": "CrankshaftGear/z",
      "locator": "scripts/accessory_gears.py GTSIO_STATIC_DRIVE_GEARS CrankshaftGear z: axial station of the timing gear, mm"
    }
  },
  "checks": [
    {
      "id": "displacement-from-bore-stroke",
      "kind": "displacement",
      "title": "Six cylinders of 5.250 in bore and 4.000 in stroke sweep the stated 520 cubic inches",
      "source": [
        {
          "source": "manual",
          "where": "C-3-2 (PDF p.152): Detail Engine Specifications, Bore, Stroke, Displacement",
          "verified": "page image"
        },
        {
          "source": "manual",
          "where": "A-1-1 (PDF p.13) section 1-2 and A-2-1/A-2-2 (PDF p.15): six cylinders, four piston strokes per cycle",
          "verified": "page image"
        }
      ],
      "cylinders": 6,
      "bore": {
        "value": 5.25,
        "unit": "in"
      },
      "stroke": {
        "value": 4.0,
        "unit": "in"
      },
      "stated": {
        "value": 520,
        "unit": "cu in"
      },
      "tolerance": {
        "abs": 0.5,
        "unit": "cu in",
        "why": "the manual prints 520 to the nearest cubic inch, so half a unit is the rounding it can hide"
      }
    },
    {
      "id": "propeller-rpm-to-engine-rpm",
      "kind": "formula",
      "title": "2275 propeller rpm through the 0.667:1 reduction is an engine speed inside the stated rated-speed band",